{
  "schema_version": "2.0",
  "audit": {
    "name": "seeded-session-store-in-process-behind-replicas",
    "audit_version": 1,
    "status": "reported",
    "created": "2026-07-13",
    "updated": "2026-07-13",
    "mode": "fresh",
    "plan_aware": false,
    "commit": "abc1234",
    "archetype": "api-service",
    "scale": "side-project",
    "risk_profile": "balanced",
    "engine_version": "2.0.0",
    "pack_version": "2.0.0",
    "capabilities": [
      "static"
    ],
    "assumptions": []
  },
  "compliance": {
    "result": "pass",
    "screened": "2026-07-13",
    "policy_pack": "provider-neutral@1"
  },
  "domains": [
    {
      "id": "architecture",
      "status": "applicable",
      "weight": 8,
      "checks": [
        {
          "id": "A-ARCH-27",
          "outcome": "fail",
          "confidence": "Certain",
          "weight": 0,
          "evidence": [
            "E-1",
            "E-2"
          ],
          "finding_ids": [
            "F-ARCH-1"
          ]
        },
        {
          "id": "A-ARCH-21",
          "outcome": "fail",
          "confidence": "Certain",
          "weight": 60,
          "evidence": [
            "E-1",
            "E-2"
          ],
          "finding_ids": [
            "F-ARCH-1"
          ]
        },
        {
          "id": "A-ARCH-12",
          "outcome": "pass",
          "confidence": "Firm",
          "weight": 40,
          "evidence": [
            "E-2"
          ],
          "finding_ids": []
        }
      ]
    }
  ],
  "evidence": [
    {
      "id": "E-1",
      "type": "source",
      "path": "src/session-store.js",
      "line": 8,
      "quote": "const sessions = new Map();",
      "sha256": "aaaaaaaaaaaaaaaaaaaaaaaaaaaaaaaaaaaaaaaaaaaaaaaaaaaaaaaaaaaaaaaa",
      "redacted": false
    },
    {
      "id": "E-2",
      "type": "source",
      "path": "docs/architecture.md",
      "line": 4,
      "quote": "- The login path is performant at p95 700 ms and p99 1100 ms measured at the Service, with the single identity directory lookup capped at 400 ms.",
      "sha256": "bbbbbbbbbbbbbbbbbbbbbbbbbbbbbbbbbbbbbbbbbbbbbbbbbbbbbbbbbbbbbbbb",
      "redacted": false
    }
  ],
  "strengths": [],
  "findings": [
    {
      "id": "F-ARCH-1",
      "domain": "architecture",
      "title": "Signed-in session state lives in one process behind six replicas",
      "severity": "High",
      "confidence": "Certain",
      "effort": "S",
      "evidence": [
        "E-1",
        "E-2"
      ],
      "impact": "A shopper authenticated by one replica is unauthenticated the moment the Service routes their next request anywhere else, so the signed-in surface fails for most requests.",
      "fix": "Move both request-serving collections into a store every replica reads, keeping the same TTL and window.",
      "verify": "node --test test/seeded.test.js",
      "checks": [
        "A-ARCH-27",
        "A-ARCH-21"
      ],
      "status": "open",
      "remediation": [
        "GA-101"
      ]
    }
  ],
  "tasks": [
    {
      "id": "GA-101",
      "phase": 1,
      "wave": "1.1",
      "title": "Fix: Signed-in session state lives in one process behind six replicas",
      "parallel": false,
      "files": [
        "src/session-store.js",
        "test/seeded.test.js"
      ],
      "depends_on": [],
      "reuses": "the existing module under audit",
      "fixes": [
        "F-ARCH-1"
      ],
      "acceptance": [
        "The seeded defect no longer reproduces.",
        "A-ARCH-27 passes with evidence on the remediated path."
      ],
      "verify": "node --test test/seeded.test.js",
      "checks": [
        "A-ARCH-27",
        "A-ARCH-21"
      ],
      "status": "open"
    },
    {
      "id": "GA-601",
      "phase": 6,
      "wave": "6.1",
      "title": "Re-run godaudits",
      "parallel": false,
      "files": [],
      "depends_on": [
        "GA-101"
      ],
      "reuses": "the current audit state",
      "fixes": [],
      "acceptance": [
        "No open Critical findings remain."
      ],
      "verify": "godaudits validate .godaudits/AUDIT.json",
      "checks": [],
      "status": "open",
      "final_gate": true
    }
  ],
  "accepted_risks": [],
  "open_questions": [],
  "session_log": [
    {
      "date": "2026-07-13",
      "summary": "Seeded corpus fixture."
    }
  ],
  "computed": {
    "coverage": {
      "applicable": 3,
      "evaluated": 3,
      "passed": 1,
      "failed": 2,
      "unknown": 0,
      "not_applicable": 0,
      "percent": 100
    },
    "domains": {
      "architecture": {
        "raw_score": 55,
        "score": 55,
        "cap": null,
        "evidence_basis": "mostly Certain"
      }
    },
    "overall": {
      "raw_score": 55,
      "score": 55,
      "verdict": "at risk",
      "grade_method": "static-read",
      "grade_scope": "an arithmetic roll-up of model-assigned pass/fail from a source read, not a test result, scan, or certification",
      "evidence_basis": "mostly Certain",
      "coverage_cap": 100,
      "critical_cap": 100,
      "weak_domain_cap": 100
    },
    "counts": {
      "findings_total": 1,
      "critical": 0,
      "high": 1,
      "medium": 0,
      "low": 0,
      "accepted_risk": 0,
      "tasks_total": 2,
      "tasks_done": 0
    }
  }
}
