{
  "schema_version": "2.0",
  "audit": {
    "name": "blind-helper-bypassed",
    "audit_version": 1,
    "status": "reported",
    "created": "2026-07-16",
    "updated": "2026-07-16",
    "mode": "fresh",
    "plan_aware": false,
    "commit": "seeded0",
    "archetype": "api-service",
    "scale": "side-project",
    "risk_profile": "balanced",
    "engine_version": "2.0.0",
    "pack_version": "2.0.0",
    "capabilities": [
      "static"
    ],
    "assumptions": [
      "Blind run: the auditor received only the repository path and the A-SEC-3 definition."
    ]
  },
  "compliance": {
    "result": "pass",
    "screened": "2026-07-16",
    "policy_pack": "provider-neutral@1"
  },
  "domains": [
    {
      "id": "security",
      "status": "applicable",
      "weight": 15,
      "checks": [
        {
          "id": "A-SEC-3",
          "outcome": "fail",
          "confidence": "Firm",
          "weight": 100,
          "evidence": [
            "E-1"
          ],
          "finding_ids": [
            "F-SEC-1"
          ]
        }
      ]
    }
  ],
  "evidence": [
    {
      "id": "E-1",
      "type": "source",
      "path": "src/documents.js",
      "line": 17,
      "quote": "  const doc = await db.documents.findOne({ id: req.query.docId });",
      "sha256": "7c1eff753f4594c43bae944e87e7690c33ee9996b4c9e8e5a49122383b583132",
      "redacted": false
    }
  ],
  "strengths": [],
  "findings": [
    {
      "id": "F-SEC-1",
      "domain": "security",
      "title": "previewDocument resolves a document by request-supplied id with no workspace predicate, bypassing the scoped() helper",
      "severity": "Critical",
      "confidence": "Firm",
      "effort": "S",
      "evidence": [
        "E-1"
      ],
      "impact": "Unlike its siblings readDocument (line 6) and listDocuments (line 11), which both route through scoped(query, req.user) to inject workspaceId, previewDocument builds its query literally from req.query.docId with no owner or tenant key. Any caller who can reach this handler can supply an arbitrary document id and receive the full title and body of a document belonging to any other workspace. This is cross-tenant data disclosure of arbitrary document contents, so Critical per the check's own severity rule. The comment at line 15 (\"Added for the share-link feature\") indicates the bypass was introduced later, defeating the invariant scope.js documents at lines 2-3 (\"Every document read must go through this helper so the workspace predicate is never forgotten\").",
      "fix": "Route the lookup through the same helper as the other handlers: `const doc = await db.documents.findOne(scoped({ id: req.query.docId }, req.user));`. If the share-link feature must serve unauthenticated viewers, do not query by document id at all: mint an unguessable share token, store it on the document, and resolve by that token (`findOne({ shareToken: <redacted:c994a7a197d2> })`) with expiry and revocation, rather than accepting a raw record id. Additionally, enforce deny-by-default centrally (middleware or a repository layer that refuses any documents query lacking a workspaceId predicate) so a future handler cannot reintroduce the same bypass.",
      "verify": "node --test test/security.test.js",
      "checks": [
        "A-SEC-3"
      ],
      "status": "open",
      "remediation": [
        "GA-101"
      ]
    }
  ],
  "tasks": [
    {
      "id": "GA-101",
      "phase": 1,
      "wave": "1.1",
      "title": "Bind the query to the caller: previewDocument resolves a document by request-supplied id with no workspace predicate, by",
      "parallel": false,
      "files": [
        "src/documents.js",
        "test/security.test.js"
      ],
      "depends_on": [],
      "reuses": "the scoping already applied by the sibling handlers",
      "fixes": [
        "F-SEC-1"
      ],
      "acceptance": [
        "The load binds the owner or tenant predicate inside the query.",
        "A cross-tenant id returns 404 rather than the record."
      ],
      "verify": "node --test test/security.test.js",
      "checks": [
        "A-SEC-3"
      ],
      "status": "open"
    },
    {
      "id": "GA-601",
      "phase": 6,
      "wave": "6.1",
      "title": "Re-run godaudits",
      "parallel": false,
      "files": [],
      "depends_on": [
        "GA-101"
      ],
      "reuses": "the current audit state",
      "fixes": [],
      "acceptance": [
        "No open Critical findings remain."
      ],
      "verify": "godaudits validate .godaudits/AUDIT.json",
      "checks": [],
      "status": "open",
      "final_gate": true
    }
  ],
  "accepted_risks": [],
  "open_questions": [],
  "session_log": [
    {
      "date": "2026-07-16",
      "summary": "Blind A-SEC-3 audit of helper-bypassed."
    }
  ],
  "computed": {
    "coverage": {
      "applicable": 1,
      "evaluated": 1,
      "passed": 0,
      "failed": 1,
      "unknown": 0,
      "not_applicable": 0,
      "percent": 100
    },
    "domains": {
      "security": {
        "raw_score": 0,
        "score": 0,
        "cap": "active Critical caps domain at 69",
        "evidence_basis": "mostly Firm"
      }
    },
    "overall": {
      "raw_score": 0,
      "score": 0,
      "verdict": "critical condition",
      "grade_method": "static-read",
      "grade_scope": "an arithmetic roll-up of model-assigned pass/fail from a source read, not a test result, scan, or certification",
      "evidence_basis": "mostly Firm",
      "coverage_cap": 100,
      "critical_cap": 79,
      "weak_domain_cap": 84
    },
    "counts": {
      "findings_total": 1,
      "critical": 1,
      "high": 0,
      "medium": 0,
      "low": 0,
      "accepted_risk": 0,
      "tasks_total": 2,
      "tasks_done": 0
    }
  }
}
