{
  "schema_version": "2.0",
  "audit": {
    "name": "blind-export-unscoped",
    "audit_version": 1,
    "status": "reported",
    "created": "2026-07-16",
    "updated": "2026-07-16",
    "mode": "fresh",
    "plan_aware": false,
    "commit": "seeded0",
    "archetype": "api-service",
    "scale": "side-project",
    "risk_profile": "balanced",
    "engine_version": "2.0.0",
    "pack_version": "2.0.0",
    "capabilities": [
      "static"
    ],
    "assumptions": [
      "Blind run: the auditor received only the repository path and the A-SEC-3 definition."
    ]
  },
  "compliance": {
    "result": "pass",
    "screened": "2026-07-16",
    "policy_pack": "provider-neutral@1"
  },
  "domains": [
    {
      "id": "security",
      "status": "applicable",
      "weight": 15,
      "checks": [
        {
          "id": "A-SEC-3",
          "outcome": "fail",
          "confidence": "Firm",
          "weight": 100,
          "evidence": [
            "E-1"
          ],
          "finding_ids": [
            "F-SEC-1"
          ]
        }
      ]
    }
  ],
  "evidence": [
    {
      "id": "E-1",
      "type": "source",
      "path": "src/contacts.js",
      "line": 15,
      "quote": "  const rows = await db.contacts.find({ segment: req.query.segment });",
      "sha256": "efcbd6e52a40577bcba04ee7961de806c0a074124b5202fc67dd484b9d1f0f20",
      "redacted": false
    }
  ],
  "strengths": [],
  "findings": [
    {
      "id": "F-SEC-1",
      "domain": "security",
      "title": "CSV export resolves contacts by request-supplied segment with no owner or tenant predicate",
      "severity": "Critical",
      "confidence": "Firm",
      "effort": "S",
      "evidence": [
        "E-1"
      ],
      "impact": "exportContacts is the only handler in the file that omits the accountId predicate its siblings apply (getContact uses { id: req.params.id, accountId: req.user.accountId } on line 5; listContacts uses { accountId: req.user.accountId } on line 10). The query filters solely on the attacker-controlled req.query.segment, so any authenticated user can stream every tenant's contacts out as CSV. The response body on line 17 emits name, email, and phone for each row, making this a cross-tenant bulk disclosure of PII, not just a single-record leak. Severity is Critical per the check's rule on both counts: PII payload and cross-tenant scope.",
      "fix": "Bind the export query to the caller's tenant the same way the siblings do: await db.contacts.find({ segment: req.query.segment, accountId: req.user.accountId }). Better, route every contacts read through one shared scoping helper that takes req.user.accountId as a required argument so a handler cannot be written without it, or enforce the predicate below the handler layer with a row-level-security policy keyed on the session's account. Also treat req.query.segment as an untrusted filter value and validate it against the allowed segment set.",
      "verify": "node --test test/security.test.js",
      "checks": [
        "A-SEC-3"
      ],
      "status": "open",
      "remediation": [
        "GA-101"
      ]
    }
  ],
  "tasks": [
    {
      "id": "GA-101",
      "phase": 1,
      "wave": "1.1",
      "title": "Bind the query to the caller: CSV export resolves contacts by request-supplied segment with no owner or tenant predicate",
      "parallel": false,
      "files": [
        "src/contacts.js",
        "test/security.test.js"
      ],
      "depends_on": [],
      "reuses": "the scoping already applied by the sibling handlers",
      "fixes": [
        "F-SEC-1"
      ],
      "acceptance": [
        "The load binds the owner or tenant predicate inside the query.",
        "A cross-tenant id returns 404 rather than the record."
      ],
      "verify": "node --test test/security.test.js",
      "checks": [
        "A-SEC-3"
      ],
      "status": "open"
    },
    {
      "id": "GA-601",
      "phase": 6,
      "wave": "6.1",
      "title": "Re-run godaudits",
      "parallel": false,
      "files": [],
      "depends_on": [
        "GA-101"
      ],
      "reuses": "the current audit state",
      "fixes": [],
      "acceptance": [
        "No open Critical findings remain."
      ],
      "verify": "godaudits validate .godaudits/AUDIT.json",
      "checks": [],
      "status": "open",
      "final_gate": true
    }
  ],
  "accepted_risks": [],
  "open_questions": [],
  "session_log": [
    {
      "date": "2026-07-16",
      "summary": "Blind A-SEC-3 audit of export-unscoped."
    }
  ],
  "computed": {
    "coverage": {
      "applicable": 1,
      "evaluated": 1,
      "passed": 0,
      "failed": 1,
      "unknown": 0,
      "not_applicable": 0,
      "percent": 100
    },
    "domains": {
      "security": {
        "raw_score": 0,
        "score": 0,
        "cap": "active Critical caps domain at 69",
        "evidence_basis": "mostly Firm"
      }
    },
    "overall": {
      "raw_score": 0,
      "score": 0,
      "verdict": "critical condition",
      "grade_method": "static-read",
      "grade_scope": "an arithmetic roll-up of model-assigned pass/fail from a source read, not a test result, scan, or certification",
      "evidence_basis": "mostly Firm",
      "coverage_cap": 100,
      "critical_cap": 79,
      "weak_domain_cap": 84
    },
    "counts": {
      "findings_total": 1,
      "critical": 1,
      "high": 0,
      "medium": 0,
      "low": 0,
      "accepted_risk": 0,
      "tasks_total": 2,
      "tasks_done": 0
    }
  }
}
