{
  "schema_version": "2.0",
  "audit": {
    "name": "seeded-caller-supplied-selector-unbound",
    "audit_version": 1,
    "status": "reported",
    "created": "2026-07-13",
    "updated": "2026-07-13",
    "mode": "fresh",
    "plan_aware": false,
    "commit": "abc1234",
    "archetype": "api-service",
    "scale": "side-project",
    "risk_profile": "balanced",
    "engine_version": "2.0.0",
    "pack_version": "2.0.0",
    "capabilities": [
      "static"
    ],
    "assumptions": []
  },
  "compliance": {
    "result": "pass",
    "screened": "2026-07-13",
    "policy_pack": "provider-neutral@1"
  },
  "domains": [
    {
      "id": "security",
      "status": "applicable",
      "weight": 15,
      "checks": [
        {
          "id": "A-SEC-30",
          "outcome": "fail",
          "confidence": "Certain",
          "weight": 0,
          "evidence": [
            "E-1",
            "E-2"
          ],
          "finding_ids": [
            "F-SEC-1"
          ]
        },
        {
          "id": "A-SEC-3",
          "outcome": "fail",
          "confidence": "Certain",
          "weight": 60,
          "evidence": [
            "E-1",
            "E-2"
          ],
          "finding_ids": [
            "F-SEC-1"
          ]
        },
        {
          "id": "A-SEC-4",
          "outcome": "pass",
          "confidence": "Firm",
          "weight": 40,
          "evidence": [
            "E-2"
          ],
          "finding_ids": []
        }
      ]
    }
  ],
  "evidence": [
    {
      "id": "E-1",
      "type": "source",
      "path": "src/profile.js",
      "line": 8,
      "quote": "getUserByEmail(req.query.email)",
      "sha256": "aaaaaaaaaaaaaaaaaaaaaaaaaaaaaaaaaaaaaaaaaaaaaaaaaaaaaaaaaaaaaaaa",
      "redacted": false
    },
    {
      "id": "E-2",
      "type": "source",
      "path": "src/router.js",
      "line": 4,
      "quote": "router.use(authorize)",
      "sha256": "bbbbbbbbbbbbbbbbbbbbbbbbbbbbbbbbbbbbbbbbbbbbbbbbbbbbbbbbbbbbbbbb",
      "redacted": false
    }
  ],
  "strengths": [],
  "findings": [
    {
      "id": "F-SEC-1",
      "domain": "security",
      "title": "Caller-supplied selector is not ownership-bound",
      "severity": "High",
      "confidence": "Certain",
      "effort": "S",
      "evidence": [
        "E-1",
        "E-2"
      ],
      "impact": "A caller can read another user profile by passing their email.",
      "fix": "Bind the lookup to the authenticated principal instead of the query parameter.",
      "verify": "node --test test/seeded.test.js",
      "checks": [
        "A-SEC-30",
        "A-SEC-3"
      ],
      "status": "open",
      "remediation": [
        "GA-101"
      ]
    }
  ],
  "tasks": [
    {
      "id": "GA-101",
      "phase": 1,
      "wave": "1.1",
      "title": "Fix: Caller-supplied selector is not ownership-bound",
      "parallel": false,
      "files": [
        "src/profile.js",
        "test/seeded.test.js"
      ],
      "depends_on": [],
      "reuses": "the existing module under audit",
      "fixes": [
        "F-SEC-1"
      ],
      "acceptance": [
        "The seeded defect no longer reproduces.",
        "A-SEC-30 passes with evidence on the remediated path."
      ],
      "verify": "node --test test/seeded.test.js",
      "checks": [
        "A-SEC-30",
        "A-SEC-3"
      ],
      "status": "open"
    },
    {
      "id": "GA-601",
      "phase": 6,
      "wave": "6.1",
      "title": "Re-run godaudits",
      "parallel": false,
      "files": [],
      "depends_on": [
        "GA-101"
      ],
      "reuses": "the current audit state",
      "fixes": [],
      "acceptance": [
        "No open Critical findings remain."
      ],
      "verify": "godaudits validate .godaudits/AUDIT.json",
      "checks": [],
      "status": "open",
      "final_gate": true
    }
  ],
  "accepted_risks": [],
  "open_questions": [],
  "session_log": [
    {
      "date": "2026-07-13",
      "summary": "Seeded corpus fixture."
    }
  ],
  "computed": {
    "coverage": {
      "applicable": 3,
      "evaluated": 3,
      "passed": 1,
      "failed": 2,
      "unknown": 0,
      "not_applicable": 0,
      "percent": 100
    },
    "domains": {
      "security": {
        "raw_score": 55,
        "score": 55,
        "cap": null,
        "evidence_basis": "mostly Certain"
      }
    },
    "overall": {
      "raw_score": 55,
      "score": 55,
      "verdict": "at risk",
      "grade_method": "static-read",
      "grade_scope": "an arithmetic roll-up of model-assigned pass/fail from a source read, not a test result, scan, or certification",
      "evidence_basis": "mostly Certain",
      "coverage_cap": 100,
      "critical_cap": 100,
      "weak_domain_cap": 100
    },
    "counts": {
      "findings_total": 1,
      "critical": 0,
      "high": 1,
      "medium": 0,
      "low": 0,
      "accepted_risk": 0,
      "tasks_total": 2,
      "tasks_done": 0
    }
  }
}
